{
  "php_version": "8.4",
  "pool": "shop",
  "user": "shop",
  "group": "shop",
  "pm": "dynamic",
  "max_children": 10,
  "start_servers": 3,
  "min_spare_servers": 2,
  "max_spare_servers": 5,
  "max_requests": 500,
  "php_admin_values": {
    "open_basedir": "/srv/falak/sites/shop:/tmp"
  },
  "env": {
    "FALAK_SITE_ID": "01J9ZQ3M4B5C6D7E8F9G0H1J2K"
  },
  "state": "present",
  "slice": "site_shop",
  "oom_score_adj": -500,
  "slowlog_timeout": 5
}
